发布时间,新闻标题,URL,影响评分
2024-05-16,通威股份：连续4日融资净偿还累计3922.14万元（05-15）,http://stock.eastmoney.com/a/202405163077907568.html,-1
2024-05-15,通威股份：连续3日融资净偿还累计2452.71万元（05-14）,http://stock.eastmoney.com/a/202405153076528340.html,-1
2024-05-14,通威股份：融资净偿还306.12万元，融资余额37.04亿元（05-13）,http://stock.eastmoney.com/a/202405143075298453.html,0
2024-05-13,通威股份：公司于四川省广元市苍溪县暂无光伏组件项目投资,http://finance.eastmoney.com/a/202405133074819279.html,0
2024-05-13,通威股份：公司目前拥有高纯晶硅年产能45万吨,http://finance.eastmoney.com/a/202405133074819130.html,2
2024-05-13,请问集团是否考虑在猪周期复苏起点布局养猪产业以扩大发展？通威股份：暂无相关业务发展规划,http://finance.eastmoney.com/a/202405133074803326.html,0
2024-05-13,新能源早参｜通威股份旗下公司与隆基绿能及子公司签订近400亿元大单,http://finance.eastmoney.com/a/202405133073987739.html,3
2024-05-12,通威股份与中材海外签署战略合作协议,http://finance.eastmoney.com/a/202405123073867856.html,2
2024-05-12,通威股份董事长、CEO刘舒琪一行拜访华能能源交通公司,http://finance.eastmoney.com/a/202405123073843428.html,2
2024-05-12,两大千亿巨头携手！通威股份与隆基绿能签订391亿元销售长单,http://finance.eastmoney.com/a/202405113073693515.html,2
2024-05-11,光伏行业巨头“抱团取暖” 通威股份牵手隆基绿能签391亿长单,http://finance.eastmoney.com/a/202405113073768236.html,1
2024-05-11,两大光伏巨头大单落地 通威股份与隆基绿能签订391亿元销售长单,http://finance.eastmoney.com/a/202405113073747077.html,2
2024-05-11,近400亿，隆基绿能与通威股份再签硅料长单,http://finance.eastmoney.com/a/202405113073643438.html,1
2024-05-11,通威股份与隆基绿能签订不少于86.24万吨高纯晶硅销售合同,http://finance.eastmoney.com/a/202405113073640750.html,2
2024-05-11,通威股份：融资净偿还1245.52万元，融资余额37.07亿元（05-10）,http://stock.eastmoney.com/a/202405113073442181.html,0
2024-05-11,看好光伏行业长期向好趋势 通威股份和隆基绿能再签“长单”,http://finance.eastmoney.com/a/202405113073164787.html,3
2024-05-10,公告精选丨浙商证券：拟参与竞拍国都证券7.4159%股份；通威股份：与隆基绿能签订391亿元高纯晶硅产品销售合同,http://finance.eastmoney.com/a/202405103073146159.html,3
2024-05-10,5月11日上市公司重要公告集锦：通威股份与隆基绿能签订2024年—2026年高纯晶硅销售合同,http://finance.eastmoney.com/a/202405103073128959.html,2
2024-05-10,通威股份：与隆基绿能方面签订高纯晶硅销售合同,http://finance.eastmoney.com/a/202405103073086154.html,3
2024-05-10,公告精选：通威股份与隆基绿能签订2024年—2026年高纯晶硅销售合同,http://finance.eastmoney.com/a/202405103073086321.html,1
2024-05-10,通威股份：与隆基绿能签署不少于86.24万吨高纯晶硅销售合同 总金额约391亿元,http://finance.eastmoney.com/a/202405103073064448.html,3
2024-05-10,近400亿大单！通威股份与隆基绿能签订高纯晶硅销售合同,http://finance.eastmoney.com/a/202405103073066461.html,3
2024-05-10,通威股份：与隆基绿能签署高纯晶硅销售合同,http://finance.eastmoney.com/a/202405103073058887.html,3
2024-05-10,通威股份：与隆基绿能签订高纯晶硅销售合同 预计总金额约391亿元,http://finance.eastmoney.com/a/202405103073033641.html,3
2024-05-10,通威股份：与隆基绿能签订2024年—2026年高纯晶硅销售合同,http://finance.eastmoney.com/a/202405103073015455.html,2
2024-05-10,通威股份：与隆基绿能签订高纯晶硅销售合同,http://finance.eastmoney.com/a/202405103073017636.html,3
2024-05-10,通威股份：与隆基绿能签订高纯晶硅销售合同 预计总金额约391亿元,http://finance.eastmoney.com/a/202405103073013257.html,2
2024-05-10,通威股份：融资净买入504.04万元，融资余额37.2亿元（05-09）,http://stock.eastmoney.com/a/202405103072071798.html,1
2024-05-09,通威股份：融资净偿还432.03万元，融资余额37.15亿元（05-08）,http://stock.eastmoney.com/a/202405093070702886.html,0
2024-05-08,通威股份：融资净偿还1054.5万元，融资余额37.19亿元（05-07）,http://stock.eastmoney.com/a/202405083069338861.html,0
2024-05-07,【调研快报】通威股份接待博时基金等多家机构调研,http://stock.eastmoney.com/a/202405073068983655.html,2
2024-05-07,通威股份5月7日大宗交易成交329.43万元,http://finance.eastmoney.com/a/202405073068935220.html,2
2024-05-07,通威股份：累计回购约525万股,http://finance.eastmoney.com/a/202405073068908761.html,2
2024-05-07,通威股份：截至2024年4月29日前十大流通股东持股占比54.37%,http://finance.eastmoney.com/a/202405073068908631.html,1
2024-05-07,大宗交易：通威股份成交329.43万元，成交价22.38元（05-07）,http://stock.eastmoney.com/a/202405073068852788.html,0
2024-05-07,通威股份：融资净买入7207.66万元，融资余额37.3亿元（05-06）,http://stock.eastmoney.com/a/202405073067981246.html,1
2024-05-06,通威股份拟斥资20亿-40亿元回购：一季度业绩转亏 坦承“票据池业务存风险”,http://finance.eastmoney.com/a/202405063067274120.html,-2
2024-05-05,通威股份：首次回购公司股份成交总金额1.14亿元,http://finance.eastmoney.com/a/202405053066553593.html,1
2024-05-05,通威股份：首次回购公司股份1.14亿元,"http://finance.eastmoney.com/news/1354,202405053066548156.html",2
2024-05-05,通威股份：以1.14亿元首次回购524.95万股公司股份,http://finance.eastmoney.com/a/202405053066549924.html,2
2024-05-05,通威股份：首次回购约525万股,http://finance.eastmoney.com/a/202405053066536888.html,1
2024-05-01,光伏革新加速 通威股份打造光伏“生态”,http://finance.eastmoney.com/a/202405013066101376.html,3
2024-05-01,通威股份发布2023年报，组件出货量首次进入全球前五,http://finance.eastmoney.com/a/202405013066061740.html,-2
2024-05-01,通威股份：融资净买入7723.53万元，两市排名第九（04-30）,http://stock.eastmoney.com/a/202405013065885818.html,2
2024-04-30,行业暴利时代终结 去年“光伏盈利王”通威股份一季度亏近8亿元,http://finance.eastmoney.com/a/202404303065658483.html,-3
2024-04-30,通威股份2023年实现净利润135.74亿元 拟分红超40亿元,http://finance.eastmoney.com/a/202404303065643065.html,-3
2024-04-30,光伏产业链价格持续探底，通威股份2023年净利同比降47.25%,http://finance.eastmoney.com/a/202404303065422917.html,-3
2024-04-30,通威股份(600438.SH)：2024年一季度净亏损7.87亿元，同比由盈转亏,http://finance.eastmoney.com/a/202404303065364384.html,-4
2024-04-30,光伏行业鏖战寒冬 通威股份稳字当头穿越周期,http://finance.eastmoney.com/a/202404303065338932.html,-2
2024-04-30,通威股份2023年净利润136亿元 拟回购20亿元-40亿元公司股份,http://finance.eastmoney.com/a/202404303065274581.html,-2
2024-04-30,千亿巨头通威股份7年来首次季度亏损！,http://finance.eastmoney.com/a/202404303064779961.html,-4
2024-04-30,通威股份：融资余额35.8亿元，创近一年新低（04-29）,http://stock.eastmoney.com/a/202404303064615082.html,-2
2024-04-29,通威股份去年盈利135.74亿元 管理层预计今年Topcon占比超过80%,http://finance.eastmoney.com/a/202404293064222938.html,-1
2024-04-29,多家公司将大额回购股份 通威股份拟以20亿元-40亿元回购,http://finance.eastmoney.com/a/202404293064192534.html,-1
2024-04-29,年报观察|通威股份2023年营收1391.04亿元 光伏业务表现亮眼,http://finance.eastmoney.com/a/202404293064185025.html,-3
2024-04-29,通威股份：拟以20亿元-40亿元回购股份,http://finance.eastmoney.com/a/202404293064110766.html,1
2024-04-29,通威股份2023年净利润136亿元 今年拟出货高纯晶硅55万吨、组件50GW,http://finance.eastmoney.com/a/202404293064100532.html,-1
2024-04-29,通威股份2023年报：分红、回购、增持并举 积极提升股东回报与市场信心,http://finance.eastmoney.com/a/202404293064059840.html,-2
2024-04-29,通威股份：一季度亏损7.87亿元 拟20亿元—40亿元回购股份,http://finance.eastmoney.com/a/202404293064039239.html,-2
2024-04-29,通威股份拟20亿-40亿元回购股份,http://finance.eastmoney.com/a/202404293064034660.html,2
2024-04-29,通威股份：一季度净亏损7.87亿元 上年同期归母净利润86.01亿元,http://finance.eastmoney.com/a/202404293064019173.html,-4
2024-04-29,通威股份：一季度净亏损7.87亿元 拟20亿元-40亿元回购股份,http://finance.eastmoney.com/a/202404293064011054.html,-2
2024-04-27,通威股份：融资余额35.97亿元，创近一年新低（04-26）,http://stock.eastmoney.com/a/202404273061979533.html,-2
2024-04-27,通威股份04月26日获沪股通增持640.11万股,http://stock.eastmoney.com/a/202404273061776334.html,2
2024-04-26,通威股份一行到访美的集团,http://finance.eastmoney.com/a/202404263060353115.html,0
2024-04-26,通威股份：融资余额36.36亿元，创近一年新低（04-25）,http://stock.eastmoney.com/a/202404263060178449.html,-1
2024-04-25,通威股份市值跌破1000亿，“光伏千亿俱乐部”仅存两家公司,http://finance.eastmoney.com/a/202404253059336142.html,-3
2024-04-25,通威股份：融资余额36.49亿元，创近一年新低（04-24）,http://stock.eastmoney.com/a/202404253058361293.html,-2
2024-04-25,通威股份04月24日获沪股通增持254.71万股,http://stock.eastmoney.com/a/202404253058207889.html,2
2024-04-25,通威股份市值跌破千亿元 硅料价格快速崩塌 N型时代如何转型？,http://finance.eastmoney.com/a/202404243058002397.html,-3
2024-04-24,通威股份盘中跌超5% 成交额超5亿元,http://finance.eastmoney.com/a/202404243057251086.html,4
2024-04-24,通威股份盘中跌超5%,http://stock.eastmoney.com/a/202404243057220545.html,-2
2024-04-24,通威股份：融资余额37亿元，创近一年新低（04-23）,http://stock.eastmoney.com/a/202404243056627952.html,-1
2024-04-24,通威股份04月23日被沪股通减持292.71万股,http://stock.eastmoney.com/a/202404243056530846.html,-2
2024-04-23,通威股份：融资余额37.47亿元，创近一年新低（04-22）,http://stock.eastmoney.com/a/202404233055064860.html,-2
2024-04-20,通威股份：融资余额37.83亿元，创近一年新低（04-19）,http://stock.eastmoney.com/a/202404203052811018.html,-2
2024-04-20,通威股份04月19日被沪股通减持332.43万股,http://stock.eastmoney.com/a/202404203052675626.html,-2
2024-04-19,通威股份：融资净偿还3841.19万元，融资余额38.29亿元（04-18）,http://stock.eastmoney.com/a/202404193051173018.html,-1
2024-04-18,通威股份：融资净买入122.66万元，融资余额38.68亿元（04-17）,http://stock.eastmoney.com/a/202404183049489493.html,0
2024-04-17,通威股份在四川乐山成立树脂公司 注册资本3.6亿元,http://finance.eastmoney.com/a/202404173048777310.html,2
2024-04-17,通威股份3.6亿元成立树脂新公司,http://finance.eastmoney.com/a/202404173048558146.html,2
2024-04-17,通威股份：连续4日融资净偿还累计7562.49万元（04-16）,http://stock.eastmoney.com/a/202404173047505898.html,-1
2024-04-16,通威股份：连续3日融资净偿还累计5148.61万元（04-15）,http://stock.eastmoney.com/a/202404163045252755.html,-1
2024-04-13,通威股份：融资净偿还2564.96万元，融资余额39亿元（04-12）,http://stock.eastmoney.com/a/202404133042839172.html,-1
2024-04-12,通威股份、华电在内蒙古投资成立新公司 注册资本12.5亿元,http://finance.eastmoney.com/a/202404123042339972.html,2
2024-04-12,通威股份内蒙古投资成立新公司,http://finance.eastmoney.com/a/202404123042310860.html,1
2024-04-12,通威股份：融资净偿还1643.79万元，融资余额39.26亿元（04-11）,http://stock.eastmoney.com/a/202404123041381177.html,-1
2024-04-11,通威股份：融资净买入395.92万元，融资余额39.42亿元（04-10）,http://stock.eastmoney.com/a/202404113039861961.html,1
2024-04-10,通威股份：连续4日融资净偿还累计6639.27万元（04-09）,http://stock.eastmoney.com/a/202404103038287762.html,-1
2024-04-09,通威股份：连续3日融资净偿还累计4649.4万元（04-08）,http://stock.eastmoney.com/a/202404093036847636.html,-2
2024-04-08,通威股份股东户数减少218户，户均持股31.68万元,http://stock.eastmoney.com/a/202404083036222872.html,-2
2024-04-04,通威股份：融资净偿还1624.4万元，融资余额39.74亿元（04-03）,http://stock.eastmoney.com/a/202404043034705682.html,-1
2024-04-04,通威股份04月03日获沪股通增持294.93万股,http://stock.eastmoney.com/a/202404043034578810.html,2
2024-04-03,通威股份：融资净偿还1483.24万元，融资余额39.9亿元（04-02）,http://stock.eastmoney.com/a/202404033033268230.html,-1
2024-04-03,通威股份04月02日获沪股通增持338.64万股,http://stock.eastmoney.com/a/202404033033086441.html,2
2024-04-02,通威股份：第一季度“通22转债”转股308股 累计转股约43万股,http://finance.eastmoney.com/a/202404023032911460.html,0
2024-04-02,通威股份：融资净买入3393.83万元，融资余额40.05亿元（04-01）,http://stock.eastmoney.com/a/202404023031764186.html,1
2024-04-01,20家A股上市公司一季度增持计划金额上限超2亿元！通威股份和荣盛石化控股股东拟增持最高20亿元 海昇药业实控人拟增持100股被股民戏称“最抠门”,http://finance.eastmoney.com/a/202404013030487379.html,2
2024-03-30,通威股份：融资净偿还1611.61万元，融资余额39.71亿元（03-29）,http://stock.eastmoney.com/a/202403303029999444.html,0
2024-03-29,通威股份：融资净偿还73.28万元，融资余额39.87亿元（03-28）,http://stock.eastmoney.com/a/202403293028600952.html,0
2024-03-28,通威股份：融资净买入423.81万元，融资余额39.88亿元（03-27）,http://stock.eastmoney.com/a/202403283026849043.html,0
2024-03-27,通威股份：融资净买入243.72万元，融资余额39.83亿元（03-26）,http://stock.eastmoney.com/a/202403273025113115.html,1
2024-03-26,通威股份：连续4日融资净偿还累计1754.78万元（03-25）,http://stock.eastmoney.com/a/202403263023592094.html,-1
2024-03-23,通威股份：连续3日融资净偿还累计752.55万元（03-22）,http://stock.eastmoney.com/a/202403233021784874.html,-1
2024-03-22,股价异动观察 | 天邦食品开盘涨停！百亿营收猪企申请重整，大债主通威股份或成白衣骑士？,http://finance.eastmoney.com/a/202403223021035569.html,1
2024-03-22,通威股份：融资净偿还191.24万元，融资余额39.95亿元（03-21）,http://stock.eastmoney.com/a/202403223020217989.html,0
2024-03-21,通威股份：融资净偿还130.31万元，融资余额39.97亿元（03-20）,http://stock.eastmoney.com/a/202403213018784653.html,0
2024-03-21,通威股份03月20日获沪股通增持231.23万股,http://stock.eastmoney.com/a/202403213018578861.html,2
2024-03-20,通威股份：融资净买入1048.91万元，融资余额39.99亿元（03-19）,http://stock.eastmoney.com/a/202403203017314635.html,2
2024-03-20,通威股份03月19日被沪股通减持229.61万股,http://stock.eastmoney.com/a/202403203017114014.html,-2
2024-03-19,通威股份：融资净偿还1203.36万元，融资余额39.88亿元（03-18）,http://stock.eastmoney.com/a/202403193015868497.html,0
2024-03-19,通威股份03月18日获沪股通增持275.91万股,http://stock.eastmoney.com/a/202403193015668329.html,2
2024-03-16,通威股份：融资净偿还3816.05万元，融资余额40亿元（03-15）,http://stock.eastmoney.com/a/202403163014033073.html,-1
2024-03-15,通威股份：融资净买入4504.87万元，融资余额40.38亿元（03-14）,http://stock.eastmoney.com/a/202403153012831490.html,1
2024-03-14,通威股份股东户数下降5.90%，户均持股33.73万元,http://stock.eastmoney.com/a/202403143012198242.html,-2
2024-03-14,通威股份：融资净买入747.21万元，融资余额39.93亿元（03-13）,http://stock.eastmoney.com/a/202403143011377120.html,1
2024-03-13,通威股份：融资净偿还3321.94万元，融资余额39.86亿元（03-12）,http://stock.eastmoney.com/a/202403133010007460.html,0
2024-03-13,通威股份03月12日获沪股通增持537.03万股,http://stock.eastmoney.com/a/202403133009820664.html,2
2024-03-12,通威股份：融资净买入8204.33万元，融资余额40.19亿元（03-11）,http://stock.eastmoney.com/a/202403123008570983.html,1
2024-03-12,通威股份03月11日被沪股通减持487.32万股,http://stock.eastmoney.com/a/202403123008410088.html,-2
2024-03-09,“聪明资金”本周出逃超31亿元，宁德时代、通威股份遭抛售,http://stock.eastmoney.com/a/202403093006954632.html,-3
2024-03-09,通威股份：融资净偿还905.03万元，融资余额39.37亿元（03-08）,http://stock.eastmoney.com/a/202403093006765236.html,-2
2024-03-09,通威股份03月08日被沪股通减持295.76万股,http://stock.eastmoney.com/a/202403093006609327.html,-2
2024-03-08,通威股份：连续4日融资净买入累计6607.43万元（03-07）,http://stock.eastmoney.com/a/202403083005325860.html,1
2024-03-08,通威股份03月07日被沪股通减持735.07万股,http://stock.eastmoney.com/a/202403083005144943.html,-2
2024-03-07,通威股份：连续3日融资净买入累计4691.66万元（03-06）,http://stock.eastmoney.com/a/202403073004124571.html,2
2024-03-07,通威股份03月06日被沪股通减持641.67万股,http://stock.eastmoney.com/a/202403073003946366.html,-2
2024-03-06,通威股份：融资净买入3293.22万元，融资余额39.16亿元（03-05）,http://stock.eastmoney.com/a/202403063002900767.html,2
2024-03-05,通威股份：融资净买入282.47万元，融资余额38.83亿元（03-04）,http://stock.eastmoney.com/a/202403053001894867.html,0
2024-03-02,通威股份：融资净偿还1195.09万元，融资余额38.8亿元（03-01）,http://stock.eastmoney.com/a/202403023000306140.html,-1
2024-03-01,通威股份：连续3日融资净买入累计3081.6万元（02-29）,http://stock.eastmoney.com/a/202403012999061894.html,1
2024-02-29,通威股份：融资净买入2193.11万元，融资余额38.82亿元（02-28）,http://stock.eastmoney.com/a/202402292997798474.html,2
2024-02-28,通威股份：融资净买入65.33万元，融资余额38.6亿元（02-27）,http://stock.eastmoney.com/a/202402282996492974.html,1
2024-02-27,通威股份：融资净偿还1351.4万元，融资余额38.59亿元（02-26）,http://stock.eastmoney.com/a/202402272995190939.html,-1
2024-02-26,大宗交易：通威股份成交396.36万元，成交价25.94元（02-26）,http://stock.eastmoney.com/a/202402262994631753.html,0
2024-02-24,通威股份：融资净买入1967.92万元，融资余额38.73亿元（02-23）,http://stock.eastmoney.com/a/202402242993632044.html,2
2024-02-23,美的集团与通威股份签署战略合作协议,http://finance.eastmoney.com/a/202402232992978172.html,2
2024-02-23,通威股份：融资净偿还2583.33万元，融资余额38.53亿元（02-22）,http://stock.eastmoney.com/a/202402232992397732.html,-2
2024-02-22,美的集团：与通威股份签署战略合作协议 共同推进光伏设备在各行业的应用,http://finance.eastmoney.com/a/202402222992078130.html,2
2024-02-22,美的集团与通威股份签署战略合作协议,http://finance.eastmoney.com/a/202402222992073742.html,2
2024-02-22,通威股份：连续3日融资净买入累计5291.73万元（02-21）,http://stock.eastmoney.com/a/202402222991204010.html,2
2024-02-21,通威股份：公司生产经营情况正常,http://finance.eastmoney.com/a/202402212990577677.html,0
2024-02-21,通威股份：融资净买入809.76万元，融资余额38.63亿元（02-20）,http://stock.eastmoney.com/a/202402212989980823.html,1
2024-02-20,通威股份：融资净买入2840.38万元，融资余额38.55亿元（02-19）,http://stock.eastmoney.com/a/202402202988788429.html,2
2024-02-08,通威股份、爱旭股份、中润光能位列2023年光伏电池出货榜前三 头部厂商已着手PERC产线改造升级,http://finance.eastmoney.com/a/202402082986575033.html,2
2024-02-08,通威股份投资新设硅能源公司 注册资本1亿元,http://finance.eastmoney.com/a/202402082986219528.html,2
2024-02-08,通威股份：融资余额39.15亿元，创近一年新低（02-07）,http://stock.eastmoney.com/a/202402082985833827.html,-2
2024-02-07,通威股份于鄂尔多斯投资成立绿色基材公司,http://finance.eastmoney.com/a/202402072984949242.html,2
2024-02-07,通威股份：融资余额39.18亿元，创近一年新低（02-06）,http://stock.eastmoney.com/a/202402072984551582.html,-1
2024-02-07,通威股份02月06日获沪股通增持358.95万股,http://stock.eastmoney.com/a/202402072984359649.html,2
2024-02-06,通威股份成立综合管理服务公司 注册资本5000万元,http://finance.eastmoney.com/a/202402062983848138.html,2
2024-02-06,通威股份5000万元成立综合管理服务公司,http://finance.eastmoney.com/a/202402062983818192.html,2
2024-02-06,通威股份：融资余额39.92亿元，创近一年新低（02-05）,http://stock.eastmoney.com/a/202402062983235532.html,-2
2024-02-03,通威股份：融资余额40.41亿元，创近一年新低（02-02）,http://stock.eastmoney.com/a/202402032981436620.html,-1
2024-02-03,通威股份02月02日被沪股通减持316.97万股,http://stock.eastmoney.com/a/202402032981286667.html,-1
2024-02-02,通威股份：融资余额40.5亿元，创近一年新低（02-01）,http://stock.eastmoney.com/a/202402022980200365.html,-2
2024-02-02,通威股份02月01日获沪股通增持810.23万股,http://stock.eastmoney.com/a/202402022980017236.html,2
2024-02-01,海外大单！光伏龙头通威股份签了,http://finance.eastmoney.com/a/202402012979857868.html,2
2024-02-01,通威股份控股股东拟巨额增持 坚定看好行业发展前景及公司竞争优势,http://finance.eastmoney.com/a/202402012979420041.html,3
2024-02-01,通威股份：控股股东通威集团拟以10亿元—20亿元增持公司股份,http://finance.eastmoney.com/a/202402012979353275.html,2
2024-02-01,光伏板块逆市活跃，爱旭股份涨停，通威股份等走高,http://finance.eastmoney.com/a/202402012979276223.html,1
2024-02-01,光伏概念股震荡反弹，通威股份涨超6%,http://stock.eastmoney.com/a/202402012979247697.html,2
2024-02-01,BC电池板块盘初走高 通威股份涨超6%,http://stock.eastmoney.com/a/202402012979244048.html,2
2024-02-01,光伏概念股震荡反弹 通威股份涨超6%,http://stock.eastmoney.com/a/202402012979245320.html,2
2024-02-01,BC电池板块盘初反弹，通威股份涨超6%,http://stock.eastmoney.com/a/202402012979242488.html,2
2024-02-01,BC电池板块盘初反弹 爱旭股份、通威股份涨超6%,http://stock.eastmoney.com/a/202402012979236613.html,2
2024-02-01,新能源早参｜通威集团拟增持通威股份；广州发展子公司同江陵县政府签署合作协议,http://finance.eastmoney.com/a/202402012979019010.html,2
2024-02-01,通威股份：融资余额41.21亿元，创近一年新低（01-31）,http://stock.eastmoney.com/a/202402012978868728.html,-2
2024-02-01,光伏“业绩雷”频发 又一龙头护盘？通威股份控股股东拟增持不低于10亿元,http://finance.eastmoney.com/a/202401312978515222.html,2
2024-01-31,千亿硅料龙头新动作！通威股份大股东拟增持不超20亿元股份,http://finance.eastmoney.com/a/202401312978523688.html,2
2024-01-31,2月1日上市公司重要公告集锦：通威股份控股股东拟10亿元至20亿元增持股份,http://finance.eastmoney.com/a/202401312978510195.html,3
2024-01-31,公告精选丨通威股份：控股股东通威集团拟10亿元—20亿元增持公司股份；三一重工：董事长提议以6亿元—10亿元回购股份,http://finance.eastmoney.com/a/202401312978486387.html,2
2024-01-31,逾60家A股公司“扎堆”拟回购或增持股份 通威股份拟增持金额超10亿元,http://finance.eastmoney.com/a/202401312978438218.html,2
2024-01-31,通威股份：控股股东将拿出最少10亿增持公司股份,http://finance.eastmoney.com/a/202401312978431994.html,2
2024-01-31,通威股份：控股股东拟增持10亿元-20亿元,http://finance.eastmoney.com/a/202401312978397414.html,3
2024-01-31,通威股份：通威集团有限公司拟增持公司股份不低于10亿元 不超过20亿元,http://finance.eastmoney.com/a/202401312978394870.html,2
2024-01-31,大手笔！通威股份控股股东拟增持股份,http://finance.eastmoney.com/a/202401312978391392.html,2
2024-01-31,通威股份：控股股东拟以10亿-20亿元增持股份,http://finance.eastmoney.com/a/202401312978365035.html,2
2024-01-31,通威股份：控股股东通威集团拟10亿元-20亿元增持公司股份,http://finance.eastmoney.com/a/202401312978355331.html,2
2024-01-31,通威股份：控股股东拟增持10亿元-20亿元,http://finance.eastmoney.com/a/202401312978349358.html,2
2024-01-31,通威股份：控股股东拟10亿至20亿元增持公司股份,http://finance.eastmoney.com/a/202401312978349527.html,3
2024-01-31,通威股份子公司为保山20万吨高纯晶项目承建单位提供2亿元贷款 利率4.2%,http://finance.eastmoney.com/a/202401312978096236.html,-2
2024-01-31,通威股份：融资余额41.65亿元，创近一年新低（01-30）,http://stock.eastmoney.com/a/202401312977470423.html,-2
2024-01-31,通威股份01月30日获沪股通增持288.69万股,http://stock.eastmoney.com/a/202401312977374463.html,2
