发布时间,新闻标题,URL,影响评分
2024-01-30,通威股份：融资净买入137.56万元，融资余额42亿元（01-29）,http://stock.eastmoney.com/a/202401302976091120.html,1
2024-01-30,通威股份01月29日获沪股通增持656.19万股,http://stock.eastmoney.com/a/202401302975943014.html,2
2024-01-27,通威股份：融资净偿还4939.51万元，融资余额41.99亿元（01-26）,http://stock.eastmoney.com/a/202401272974517525.html,-1
2024-01-27,通威股份01月26日获沪股通增持282.85万股,http://stock.eastmoney.com/a/202401272974332623.html,2
2024-01-26,通威股份：融资净买入5885.92万元，融资余额42.48亿元（01-25）,http://stock.eastmoney.com/a/202401262973237383.html,1
2024-01-26,通威股份01月25日获沪股通增持279.9万股,http://stock.eastmoney.com/a/202401262973070191.html,2
2024-01-26,通威股份间接控股子公司8500万元项目环评获原则同意,http://finance.eastmoney.com/a/202401262972925590.html,2
2024-01-25,通威股份：融资余额41.89亿元，创近一年新低（01-24）,http://stock.eastmoney.com/a/202401252971921882.html,-2
2024-01-25,通威股份01月24日获沪股通增持353.88万股,http://stock.eastmoney.com/a/202401252971751919.html,2
2024-01-24,通威股份：融资净买入15.68万元，融资余额41.92亿元（01-23）,http://stock.eastmoney.com/a/202401242970567137.html,0
2024-01-23,通威股份：融资余额41.91亿元，创近一年新低（01-22）,http://stock.eastmoney.com/a/202401232969227973.html,-2
2024-01-20,通威股份：融资余额42.03亿元，创近一年新低（01-19）,http://stock.eastmoney.com/a/202401202967661622.html,-2
2024-01-20,通威股份01月19日被沪股通减持207.12万股,http://stock.eastmoney.com/a/202401202967466959.html,-2
2024-01-19,通威股份：融资余额42.3亿元，创近一年新低（01-18）,http://stock.eastmoney.com/a/202401192966342851.html,-1
2024-01-19,通威股份01月18日获沪股通增持467.3万股,http://stock.eastmoney.com/a/202401192966189284.html,2
2024-01-18,通威股份：融资净偿还885.29万元，融资余额42.65亿元（01-17）,http://stock.eastmoney.com/a/202401182965107050.html,-2
2024-01-17,通威股份：基于大绒面的两步法钙钛矿/硅叠层电池效率已达31.68%,http://finance.eastmoney.com/a/202401172963907676.html,2
2024-01-17,通威股份：融资净偿还1301.17万元，融资余额42.73亿元（01-16）,http://stock.eastmoney.com/a/202401172963824420.html,0
2024-01-16,通威股份(600438.SH)：公司已组建钙钛矿叠层电池实验室,http://finance.eastmoney.com/a/202401162963200713.html,2
2024-01-16,通威股份：太阳能电池全球累计出货量超200GW,http://finance.eastmoney.com/a/202401162962964089.html,4
2024-01-16,通威股份：融资净买入3581.54万元，融资余额42.86亿元（01-15）,http://stock.eastmoney.com/a/202401162962562436.html,3
2024-01-13,通威股份：融资余额42.51亿元，创近一年新低（01-12）,http://stock.eastmoney.com/a/202401132961133230.html,-1
2024-01-13,通威股份01月12日获沪股通增持775.06万股,http://stock.eastmoney.com/a/202401132961005461.html,1
2024-01-12,北向资金今日净卖出30.32亿元 农业银行、通威股份等获逆势加仓,http://stock.eastmoney.com/a/202401122960636171.html,2
2024-01-12,通威股份：融资净买入206.71万元，融资余额42.73亿元（01-11）,http://stock.eastmoney.com/a/202401122959723655.html,0
2024-01-12,通威股份01月11日获沪股通增持547.18万股,http://stock.eastmoney.com/a/202401122959542279.html,2
2024-01-11,通威股份：融资余额42.71亿元，创近一年新低（01-10）,http://stock.eastmoney.com/a/202401112958239646.html,-2
2024-01-10,通威股份：融资净偿还3627.79万元，融资余额42.96亿元（01-09）,http://stock.eastmoney.com/a/202401102956824876.html,-1
2024-01-09,通威股份：连续3日融资净买入累计5276.16万元（01-08）,http://stock.eastmoney.com/a/202401092955395074.html,2
2024-01-06,通威股份：融资净买入2408.57万元，融资余额43.09亿元（01-05）,http://stock.eastmoney.com/a/202401062953658998.html,2
2024-01-05,通威股份：融资净买入485.89万元，融资余额42.85亿元（01-04）,http://stock.eastmoney.com/a/202401052952305231.html,1
2024-01-05,通威股份01月04日获沪股通增持382.82万股,http://stock.eastmoney.com/a/202401052952163650.html,2
2024-01-04,通威股份：融资余额42.8亿元，创近一年新低（01-03）,http://stock.eastmoney.com/a/202401042951047322.html,-1
2024-01-03,通威股份：2023年第四季度“通22转债”转股4108股,http://finance.eastmoney.com/a/202401032950622421.html,0
2024-01-03,通威股份：融资净买入325.34万元，融资余额43.07亿元（01-02）,http://stock.eastmoney.com/a/202401032949725067.html,2
2024-06-01,通威股份与工商银行四川省分行签署战略合作协议,http://finance.eastmoney.com/a/202406013093019737.html,1
2024-06-01,通威股份与工商银行四川省分行签署战略合作协议,http://finance.eastmoney.com/a/202406013093018238.html,2
2024-06-01,通威股份：融资净买入1493.03万元，融资余额35.46亿元（05-31）,http://stock.eastmoney.com/a/202406013092799286.html,1
2024-05-31,和光同程获多家机构投资 宜宾重金再“加码”通威股份前董事长,http://finance.eastmoney.com/a/202405313092744963.html,-2
2024-05-31,通威股份：融资余额35.31亿元，创近一年新低（05-30）,http://stock.eastmoney.com/a/202405313091743189.html,-2
2024-05-30,通威股份：已形成太阳能电池95GW、光伏组件75GW年产能 高纯晶硅年产能45万吨,http://finance.eastmoney.com/a/202405303091317997.html,3
2024-05-30,通威股份：永祥能源科技一期12万吨项目，目前已达产达标达质,http://finance.eastmoney.com/a/202405303091214634.html,2
2024-05-30,通威股份：融资净偿还5613.98万元，两市排名第14（05-29）,http://stock.eastmoney.com/a/202405303090562332.html,-1
2024-05-29,光伏产业链股爆发，钧达股份等涨停，通威股份等大涨,http://finance.eastmoney.com/a/202405293089994683.html,2
2024-05-29,通威股份：连续3日融资净买入累计4997.74万元（05-28）,http://stock.eastmoney.com/a/202405293089443751.html,2
2024-05-28,数字化转型案例观察 | 通威股份：以企业数字化转型助力行业锻造新质生产力,http://finance.eastmoney.com/a/202405283088595871.html,3
2024-05-28,通威股份：融资净买入429.63万元，融资余额36.16亿元（05-27）,http://stock.eastmoney.com/a/202405283088286876.html,2
2024-05-25,通威股份：融资净买入1967.56万元，融资余额36.11亿元（05-24）,http://stock.eastmoney.com/a/202405253086846956.html,1
2024-05-24,通威股份：融资净偿还2329.89万元，融资余额35.92亿元（05-23）,http://stock.eastmoney.com/a/202405243085738562.html,-1
2024-05-23,通威股份邱艾松：拥有技术优势的企业才能在“内卷”中活下来,http://finance.eastmoney.com/a/202405233085388547.html,2
2024-05-23,通威股份：融资净偿还1.23亿元，两市排名第一（05-22）,http://stock.eastmoney.com/a/202405233084597179.html,-1
2024-05-22,通威股份市值重回千亿元 光伏板块走强,http://finance.eastmoney.com/a/202405223084196785.html,3
2024-05-22,光伏板块全线爆发 通威股份市值重回千亿元 板块复苏行情将至？,http://stock.eastmoney.com/a/202405223084157775.html,3
2024-05-22,光伏板块持续爆发 通威股份午后涨停,http://stock.eastmoney.com/a/202405223084152724.html,4
2024-05-22,通威股份涨停 市值重回千亿,http://stock.eastmoney.com/a/202405223084142954.html,1
2024-05-22,通威股份：融资净买入1406.37万元，融资余额37.38亿元（05-21）,http://stock.eastmoney.com/a/202405223083471176.html,1
2024-05-22,通威股份05月21日被沪股通减持323.27万股,http://stock.eastmoney.com/a/202405223083317331.html,-2
2024-05-22,通威股份：光伏行业第四季度会有起色,http://finance.eastmoney.com/a/202405223083188951.html,1
2024-05-21,通威股份刘汉元：最乐观预计今年第四季度光伏会有起色,http://finance.eastmoney.com/a/202405213082975378.html,1
2024-05-21,通威股份刘汉元：坚定看好光伏新能源的长期价值,http://finance.eastmoney.com/a/202405213082919023.html,2
2024-05-21,通威股份：融资净偿还595.57万元，融资余额37.24亿元（05-20）,http://stock.eastmoney.com/a/202405213082105161.html,0
2024-05-21,通威股份实际控制人、董事刘汉元：预计今年第四季度光伏行业会有起色,http://finance.eastmoney.com/a/202405213081816778.html,2
2024-05-18,通威股份：融资净买入4944.37万元，两市排名第20（05-17）,http://stock.eastmoney.com/a/202405183080437918.html,1
2024-05-17,通威股份：连续5日融资净偿还累计3971.2万元（05-16）,http://stock.eastmoney.com/a/202405173079261393.html,-1
2024-05-17,通威股份：行业优胜劣汰不可避免 今年底公司N型电池产能将超100GW,http://finance.eastmoney.com/a/202405173078977961.html,2
