发布时间,新闻标题,URL,影响评分
2024-01-16,招商银行广州分行：写好新时代金融五大文章 推动区域经济高质量发展,http://finance.eastmoney.com/a/202401162963091858.html,3
2024-01-16,券商基金早参 | 广发证券调整两融偿还规则；单只基金持仓超10%，张坤两天卖出近2亿元的招商银行,http://finance.eastmoney.com/a/202401162962927928.html,-1
2024-01-16,招商银行：连续4日融资净偿还累计1.45亿元（01-15）,http://stock.eastmoney.com/a/202401162962674875.html,-2
2024-01-15,单只基金持仓招行超10% 张坤两天卖出近2亿元的招商银行,http://finance.eastmoney.com/a/202401152962245555.html,-1
2024-01-15,遭遇净赎回？连续两天狂卖近2个亿 张坤被迫砍仓招商银行,http://finance.eastmoney.com/a/202401152961917358.html,-3
2024-01-15,上周债券承销金额较高的机构有中信银行、兴业银行、招商银行,http://bond.eastmoney.com/a/202401152961840243.html,2
2024-01-13,招商银行：融资净偿还6050.79万元，两市排名第十（01-12）,http://stock.eastmoney.com/a/202401132961202028.html,-2
2024-01-12,招商银行：融资净偿还4380.82万元，两市排名第18（01-11）,http://stock.eastmoney.com/a/202401122959793741.html,-2
2024-01-11,招商银行：股东监事彭碧宏辞任,http://finance.eastmoney.com/a/202401112959178796.html,-1
2024-01-11,招商银行：彭碧宏辞去股东监事等职务,http://finance.eastmoney.com/a/202401112959163510.html,-1
2024-01-11,招商银行：融资净偿还1969万元，融资余额77.61亿元（01-10）,http://stock.eastmoney.com/a/202401112958297411.html,1
2024-01-10,招商银行：融资净买入835.1万元，融资余额77.81亿元（01-09）,http://stock.eastmoney.com/a/202401102956927560.html,1
2024-01-09,招商银行上海分行积极响应绿色发展战略,http://finance.eastmoney.com/a/202401092956223368.html,0
2024-01-09,招商银行：融资净偿还1.22亿元，两市排名第三（01-08）,http://stock.eastmoney.com/a/202401092955461486.html,-3
2024-01-06,招商银行：融资净偿还6510.57万元，融资余额78.94亿元（01-05）,http://stock.eastmoney.com/a/202401062953673657.html,-1
2024-01-05,数据复盘丨主力资金加仓银行、家用电器等行业 北向资金抢筹格力电器、招商银行等,http://finance.eastmoney.com/a/202401052953253975.html,1
2024-01-05,招商银行：胡建华和洪小源辞去非执行董事职务,http://finance.eastmoney.com/a/202401052953222829.html,-1
2024-01-05,北向资金今日净买入19.92亿元 格力电器、招商银行等获加仓,http://finance.eastmoney.com/a/202401052953220834.html,2
2024-01-05,银行行业资金流入榜：招商银行等6股净流入资金超亿元,http://stock.eastmoney.com/a/202401052953210346.html,3
2024-01-05,北向资金今日净买入格力电器4.06亿元、招商银行2.85亿元，五粮液遭净卖出2.12亿元,http://stock.eastmoney.com/a/202401052953182544.html,2
2024-01-05,招商银行成交33.76亿元居首 力王股份换手率达77.08%,http://finance.eastmoney.com/a/202401052953138241.html,1
2024-01-05,沪深两市今日成交额合计7363亿元，招商银行成交额居首,http://stock.eastmoney.com/a/202401052953013756.html,2
2024-01-05,存款成本预期改善 招商银行领涨！聚焦银行股的恒生红利ETF（159726）涨近1%,http://finance.eastmoney.com/a/202401052952846319.html,3
2024-01-05,主力资金监控：招商银行净买入超4亿,http://stock.eastmoney.com/a/202401052952824250.html,2
2024-01-05,招商银行领涨！恒生红利ETF（159726）开年连涨3日，聚焦高股息配置价值,http://finance.eastmoney.com/a/202401052952824443.html,3
2024-01-05,招商银行：融资净买入578.16万元，融资余额79.59亿元（01-04）,http://stock.eastmoney.com/a/202401052952366415.html,2
2024-01-04,鲁大师：成都奇鲁与招商银行订立结构性存款产品协议XXXIV,http://finance.eastmoney.com/a/202401042951949560.html,0
2024-01-04,招商银行：融资净偿还3649.23万元，融资余额79.54亿元（01-03）,http://stock.eastmoney.com/a/202401042951116217.html,-2
2024-01-03,招商银行：融资净买入6710.45万元，融资余额79.9亿元（01-02）,http://stock.eastmoney.com/a/202401032949771587.html,2
2024-01-02,招商银行：融资净偿还1.12亿元，两市排名第四（12-29）,http://stock.eastmoney.com/a/202401022948781459.html,-1
2024-06-01,招商银行助力外贸高质量发展 率先落地企业名录登记业务,http://finance.eastmoney.com/a/202406013092996334.html,3
2024-06-01,招商银行：连续10日融资净买入累计8.45亿元（05-31）,http://stock.eastmoney.com/a/202406013092859742.html,2
2024-05-31,沪股通连续7日净卖出招商银行 累计净卖出10.73亿元,http://stock.eastmoney.com/a/202405313092653078.html,-2
2024-05-31,招商银行：以科技创新加强普惠金融服务,http://finance.eastmoney.com/a/202405313092634159.html,2
2024-05-31,招商银行上海分行：做产业并购全方位资金组织者 助力上市公司转型升级,http://finance.eastmoney.com/a/202405313092634648.html,2
2024-05-31,招商银行：连续9日融资净买入累计8.09亿元（05-30）,http://stock.eastmoney.com/a/202405313091732346.html,2
2024-05-30,招商银行：连续8日融资净买入累计7.74亿元（05-29）,http://stock.eastmoney.com/a/202405303090650296.html,2
2024-05-29,普华永道遭招商银行等多家上市公司解约 此前卷入恒大造假风波,http://finance.eastmoney.com/a/202405293090094735.html,-2
2024-05-29,招商银行：连续7日融资净买入累计7.5亿元（05-28）,http://stock.eastmoney.com/a/202405293089440371.html,2
2024-05-29,火爆！特别国债“秒光” 开售仅仅2分钟 招商银行便售出了全部5亿额度,http://bond.eastmoney.com/a/202405293089398495.html,2
2024-05-28,招商银行拟另聘安永为审计机构 曾拟聘普华永道,http://finance.eastmoney.com/a/202405283089364616.html,-2
2024-05-28,接连丢单！普华永道遭招商银行、中国中铁等多家上市公司解约,http://finance.eastmoney.com/a/202405283089300317.html,-1
2024-05-28,“普华”变“安永” 招商银行拟聘审计机构生变！,http://finance.eastmoney.com/a/202405283089253965.html,-2
2024-05-28,招商银行变更会计事务所,http://finance.eastmoney.com/a/202405283089214954.html,-2
2024-05-28,普华永道被取消聘任！招商银行改聘安永,http://finance.eastmoney.com/a/202405283089141766.html,0
2024-05-28,招商银行变更年审机构 安永接棒德勤！曾拟聘普华永道,http://finance.eastmoney.com/a/202405283089100687.html,-2
2024-05-28,招商银行：融资净买入5504.1万元，两市排名第18（05-27）,http://stock.eastmoney.com/a/202405283088305081.html,2
2024-05-27,招商银行取消改聘普华永道 另聘安永为年审机构,http://finance.eastmoney.com/a/202405273088223581.html,-2
2024-05-27,招商银行另聘安永 曾拟聘普华永道,http://finance.eastmoney.com/a/202405273088219461.html,0
2024-05-27,沪股通连续3日净卖出招商银行 累计净卖出3.85亿元,http://finance.eastmoney.com/a/202405273088198434.html,-2
2024-05-27,招商银行：6月25日召开董事会会议,http://finance.eastmoney.com/a/202405273088090296.html,0
2024-05-27,招商银行20年超长期特别国债半小时售罄,http://bond.eastmoney.com/a/202405273087773463.html,2
2024-05-27,招商银行20年期特别国债半小时售罄,http://finance.eastmoney.com/a/202405273087770140.html,2
2024-05-27,招商银行20年期特别国债半小时售罄,http://finance.eastmoney.com/a/202405273087759171.html,2
2024-05-27,招商银行、比亚迪等8股上周获融资净买入超2亿元,http://stock.eastmoney.com/a/202405273087666570.html,3
2024-05-25,招商银行高管层再“微调” 十年老将CIO江朝阳上调招商局集团 曾亲历招行金融科技投入大爆发,http://finance.eastmoney.com/a/202405253087011568.html,-2
2024-05-25,招商银行：融资净买入2.09亿元，两市排名第一（05-24）,http://stock.eastmoney.com/a/202405253086913476.html,2
2024-05-24,招商银行、麦格米特等5股获融资净买入超1亿元,http://stock.eastmoney.com/a/202405243086180482.html,2
2024-05-24,招商银行：融资净买入1.93亿元，两市排名第一（05-23）,http://stock.eastmoney.com/a/202405243085709463.html,2
2024-05-23,大宗交易：招商银行成交3550万元，成交均价35.50元（05-23）,http://stock.eastmoney.com/a/202405233085460494.html,-2
2024-05-23,万科：已与招商银行等头部金融机构签订协议 获得200亿元银团贷款,http://finance.eastmoney.com/a/202405233085259584.html,1
2024-05-23,万科将旗下物流公司270亿元股权质押给招商银行,http://finance.eastmoney.com/a/202405233085210248.html,2
2024-05-23,万科将旗下物流公司270亿元人民币股权质押给招商银行深圳分行,http://finance.eastmoney.com/a/202405233085180025.html,2
2024-05-23,招商银行：融资净买入1.59亿元，两市排名第二（05-22）,http://stock.eastmoney.com/a/202405233084584744.html,1
2024-05-22,大宗交易：招商银行成交1803万元，成交价36.06元（05-22）,http://stock.eastmoney.com/a/202405223084311888.html,0
2024-05-22,招商银行北京分行原行长张诚获准出任招银金租总裁 年内金租行业累计14名董事长总经理“上新”,http://finance.eastmoney.com/a/202405223084106382.html,2
2024-05-22,招商银行：融资净买入3139.34万元，融资余额68.58亿元（05-21）,http://stock.eastmoney.com/a/202405223083457537.html,2
2024-05-21,招商银行副行长朱江涛：小微贷款余额已达8450亿,http://finance.eastmoney.com/a/202405213082903828.html,3
2024-05-21,北上资金连续加仓招商银行 机构抢筹黄金股,http://finance.eastmoney.com/a/202405213082717884.html,2
2024-05-21,招商银行：融资净买入7791.67万元，两市排名第17（05-20）,http://stock.eastmoney.com/a/202405213082083765.html,1
2024-05-20,招商银行发布《普惠金融服务发展报告》,http://finance.eastmoney.com/a/202405203081734156.html,2
2024-05-20,招商银行：今日限量发行5亿超长期特别国债 售完即止,http://finance.eastmoney.com/a/202405203081724546.html,0
2024-05-20,连续3日净买入 招商银行获沪股通净买入7.59亿元,http://finance.eastmoney.com/a/202405203081643841.html,2
2024-05-20,【数据看盘】北向资金连续5日加仓招商银行 多只黄金ETF成交额环比大增,http://finance.eastmoney.com/a/202405203081620936.html,1
2024-05-20,招商银行：30年期超长期特别国债10点起对零售客户开放购买,http://finance.eastmoney.com/a/202405203081312438.html,2
2024-05-20,招商银行副行长朱江涛：小微企业贷款余额达8450亿元,http://finance.eastmoney.com/a/202405203081299837.html,2
2024-05-20,招商银行：30年期超长期特别国债10点起对零售客户开放购买,http://finance.eastmoney.com/a/202405203081289163.html,2
2024-05-19,招商银行发布《普惠金融服务发展报告》,http://finance.eastmoney.com/a/202405193080792716.html,2
2024-05-18,招商银行：融资净偿还1.04亿元，两市排名第九（05-17）,http://stock.eastmoney.com/a/202405183080554918.html,-2
2024-05-17,招商银行南昌分行监察部巡察工作办公室原资深业务经理陈凡严重违纪违法被开除党籍、行政开除,http://finance.eastmoney.com/a/202405173080292350.html,-2
2024-05-17,招商银行于深圳投资成立租赁公司,http://finance.eastmoney.com/a/202405173079887237.html,2
2024-05-17,招商银行：融资净偿还1610.06万元，融资余额68.53亿元（05-16）,http://stock.eastmoney.com/a/202405173079316895.html,0
