发布时间,新闻标题,URL,影响评分
2024-05-23,上汽集团：连续3日融资净买入累计3188.68万元（05-22）,http://stock.eastmoney.com/a/202405233084584060.html,2
2024-05-22,上汽集团：融资净买入371.9万元，融资余额12.92亿元（05-21）,http://stock.eastmoney.com/a/202405223083455587.html,2
2024-05-21,牵了一年手，如今说句I do——上汽集团和奥迪汽车正式签订合作协议,http://finance.eastmoney.com/a/202405213082776085.html,3
2024-05-21,上汽集团：融资净买入2315.42万元，融资余额12.88亿元（05-20）,http://stock.eastmoney.com/a/202405213082093382.html,2
2024-05-21,上汽集团与奥迪签署合作协议双方合作首款纯电车型预计2025年上市,http://finance.eastmoney.com/a/202405213081817570.html,2
2024-05-20,官宣！奥迪与上汽集团联合开发新平台启动 首款车型2025年上市,http://finance.eastmoney.com/a/202405203081540277.html,3
2024-05-20,首款全新电动车型明年上市 上汽集团与奥迪签订合作协议,http://finance.eastmoney.com/a/202405203081465123.html,3
2024-05-20,上汽集团、奥迪签署正式合作协议 全新纯电车型2025年推出,http://finance.eastmoney.com/a/202405203081430062.html,2
2024-05-18,上汽集团：融资净偿还1947.31万元，融资余额12.65亿元（05-17）,http://stock.eastmoney.com/a/202405183080577215.html,-1
2024-05-17,上汽集团：连续4日融资净买入累计2739.63万元（05-16）,http://stock.eastmoney.com/a/202405173079404913.html,2
